{
  "$schema": "https://json-schema.org/draft/2020-12/schema",
  "$id": "https://elianchyndale.github.io/financial-ai-contracts/v1/experiment-record.schema.json",
  "title": "ExperimentRecord",
  "type": "object",
  "additionalProperties": false,
  "required": [
    "schema_version",
    "experiment_id",
    "dataset_version",
    "model_version",
    "prompt_version",
    "retriever",
    "seed",
    "metrics",
    "commit",
    "environment",
    "started_at",
    "completed_at",
    "limitations"
  ],
  "properties": {
    "schema_version": { "const": "1.0.0" },
    "experiment_id": { "$ref": "#/$defs/identifier" },
    "dataset_version": { "type": "string", "minLength": 1, "maxLength": 128 },
    "model_version": { "type": "string", "minLength": 1, "maxLength": 128 },
    "prompt_version": { "type": "string", "minLength": 1, "maxLength": 128 },
    "retriever": { "type": "string", "minLength": 1, "maxLength": 128 },
    "seed": { "type": "integer", "minimum": 0, "maximum": 4294967295 },
    "metrics": {
      "type": "array",
      "minItems": 1,
      "items": {
        "type": "object",
        "additionalProperties": false,
        "required": ["name", "value", "unit"],
        "properties": {
          "name": { "$ref": "#/$defs/identifier" },
          "value": { "$ref": "#/$defs/signedDecimal" },
          "unit": { "type": "string", "minLength": 1, "maxLength": 64 }
        }
      }
    },
    "commit": {
      "type": "string",
      "pattern": "^(?:[0-9a-f]{40}|[0-9a-f]{64})$"
    },
    "environment": {
      "type": "object",
      "additionalProperties": false,
      "required": ["runtime", "platform", "dependency_lock_hash"],
      "properties": {
        "runtime": { "type": "string", "minLength": 1, "maxLength": 128 },
        "platform": { "type": "string", "minLength": 1, "maxLength": 128 },
        "dependency_lock_hash": { "$ref": "#/$defs/bytes32" }
      }
    },
    "started_at": {
      "type": "string",
      "format": "date-time",
      "pattern": "^.+(?:Z|[+-][0-9]{2}:[0-9]{2})$"
    },
    "completed_at": {
      "type": "string",
      "format": "date-time",
      "pattern": "^.+(?:Z|[+-][0-9]{2}:[0-9]{2})$"
    },
    "limitations": {
      "type": "array",
      "minItems": 1,
      "uniqueItems": true,
      "items": { "type": "string", "minLength": 1, "maxLength": 1000 }
    }
  },
  "$defs": {
    "identifier": {
      "type": "string",
      "pattern": "^[a-z0-9][a-z0-9._:-]{2,127}$"
    },
    "signedDecimal": {
      "type": "string",
      "pattern": "^-?(?:0|[1-9][0-9]*)(?:\\.[0-9]+)?$"
    },
    "bytes32": {
      "type": "string",
      "pattern": "^0x[0-9a-f]{64}$"
    }
  }
}
